<?xml version="1.0" encoding="UTF-8"?>
<xs:schema xmlns:xs="http://www.w3.org/2001/XMLSchema">

    <xs:element name="orders">
        <xs:complexType>
            <xs:sequence>
                <xs:element name="order" maxOccurs="unbounded">
                    <xs:complexType>
                        <xs:sequence>
                            <xs:element name="customer">
                                <xs:complexType>
                                    <xs:sequence>
                                        <xs:element name="name" type="xs:string"/>
                                        <xs:element name="email" type="xs:string">
                                        </xs:element>
                                    </xs:sequence>
                                </xs:complexType>
                            </xs:element>
                            <xs:element name="products" maxOccurs="unbounded">
                                <xs:complexType>
                                    <xs:sequence>
                                        <xs:element name="product" maxOccurs="unbounded">
                                            <xs:complexType>
                                                <xs:sequence>
                                                    <xs:element name="description" type="xs:string">
                                                    </xs:element>
                                                </xs:sequence>
                                                <xs:attribute name="sku" type="xs:string" use="required"/>
                                                <xs:attribute name="quantity" type="xs:int" use="required"/>
                                                <xs:attribute name="price" type="xs:string" use="required"/>
                                            </xs:complexType>
                                        </xs:element>
                                    </xs:sequence>
                                </xs:complexType>
                            </xs:element>
                            <xs:element name="total" type="xs:string">
                            </xs:element>
                        </xs:sequence>
                        <xs:attribute name="id" type="xs:ID" use="required"/>
                        <xs:attribute name="date" type="xs:date" use="required"/>
                        <xs:attribute name="customerId" type="xs:string" use="required"/>
                    </xs:complexType>
                </xs:element>
            </xs:sequence>
        </xs:complexType>
    </xs:element>



</xs:schema>